{
  "uid": "01HZ4F0J0G3Y2QH9N5T7AZBQ6V",
  "name": "Customer Production Webhook",
  "url": "https://api.acme.example.com/webhooks/convoy",
  "description": "Primary production webhook receiver for Acme Inc.",
  "status": "active",
  "secrets": [
    {
      "value": "whsec_5fX...redacted...",
      "uid": "sec_01HZ4F0J0G",
      "expires_at": "0001-01-01T00:00:00Z"
    }
  ],
  "http_timeout": 10,
  "rate_limit": 1000,
  "rate_limit_duration": 60,
  "advanced_signatures": true,
  "support_email": "platform@acme.example.com",
  "slack_webhook_url": "https://hooks.slack.com/services/T000/B000/redacted",
  "owner_id": "cust_acme_001",
  "created_at": "2026-04-12T15:24:11Z",
  "updated_at": "2026-05-20T09:00:00Z"
}